{
  "formatVersion": "1.0",
  "name": "USA state capitals",
  "description": "The capital city of each of the 50 states of the United States, tagged with the census region the state belongs to.",
  "tags": ["geography", "usa", "state-capitals"],
  "questions": [
    { "question": "What is the capital of Alabama?", "answer": "Montgomery", "tags": ["south"] },
    { "question": "What is the capital of Alaska?", "answer": "Juneau", "tags": ["west"] },
    { "question": "What is the capital of Arizona?", "answer": "Phoenix", "tags": ["west"] },
    { "question": "What is the capital of Arkansas?", "answer": "Little Rock", "tags": ["south"] },
    { "question": "What is the capital of California?", "answer": "Sacramento", "tags": ["west"] },
    { "question": "What is the capital of Colorado?", "answer": "Denver", "tags": ["west"] },
    { "question": "What is the capital of Connecticut?", "answer": "Hartford", "tags": ["northeast"] },
    { "question": "What is the capital of Delaware?", "answer": "Dover", "tags": ["south"] },
    { "question": "What is the capital of Florida?", "answer": "Tallahassee", "tags": ["south"] },
    { "question": "What is the capital of Georgia?", "answer": "Atlanta", "tags": ["south"] },
    { "question": "What is the capital of Hawaii?", "answer": "Honolulu", "tags": ["west"] },
    { "question": "What is the capital of Idaho?", "answer": "Boise", "tags": ["west"] },
    { "question": "What is the capital of Illinois?", "answer": "Springfield", "tags": ["midwest"] },
    { "question": "What is the capital of Indiana?", "answer": "Indianapolis", "tags": ["midwest"] },
    { "question": "What is the capital of Iowa?", "answer": "Des Moines", "tags": ["midwest"] },
    { "question": "What is the capital of Kansas?", "answer": "Topeka", "tags": ["midwest"] },
    { "question": "What is the capital of Kentucky?", "answer": "Frankfort", "tags": ["south"] },
    { "question": "What is the capital of Louisiana?", "answer": "Baton Rouge", "tags": ["south"] },
    { "question": "What is the capital of Maine?", "answer": "Augusta", "tags": ["northeast"] },
    { "question": "What is the capital of Maryland?", "answer": "Annapolis", "tags": ["south"] },
    { "question": "What is the capital of Massachusetts?", "answer": "Boston", "tags": ["northeast"] },
    { "question": "What is the capital of Michigan?", "answer": "Lansing", "tags": ["midwest"] },
    { "question": "What is the capital of Minnesota?", "answer": "Saint Paul", "tags": ["midwest"] },
    { "question": "What is the capital of Mississippi?", "answer": "Jackson", "tags": ["south"] },
    { "question": "What is the capital of Missouri?", "answer": "Jefferson City", "tags": ["midwest"] },
    { "question": "What is the capital of Montana?", "answer": "Helena", "tags": ["west"] },
    { "question": "What is the capital of Nebraska?", "answer": "Lincoln", "tags": ["midwest"] },
    { "question": "What is the capital of Nevada?", "answer": "Carson City", "tags": ["west"] },
    { "question": "What is the capital of New Hampshire?", "answer": "Concord", "tags": ["northeast"] },
    { "question": "What is the capital of New Jersey?", "answer": "Trenton", "tags": ["northeast"] },
    { "question": "What is the capital of New Mexico?", "answer": "Santa Fe", "tags": ["west"] },
    { "question": "What is the capital of New York?", "answer": "Albany", "tags": ["northeast"] },
    { "question": "What is the capital of North Carolina?", "answer": "Raleigh", "tags": ["south"] },
    { "question": "What is the capital of North Dakota?", "answer": "Bismarck", "tags": ["midwest"] },
    { "question": "What is the capital of Ohio?", "answer": "Columbus", "tags": ["midwest"] },
    { "question": "What is the capital of Oklahoma?", "answer": "Oklahoma City", "tags": ["south"] },
    { "question": "What is the capital of Oregon?", "answer": "Salem", "tags": ["west"] },
    { "question": "What is the capital of Pennsylvania?", "answer": "Harrisburg", "tags": ["northeast"] },
    { "question": "What is the capital of Rhode Island?", "answer": "Providence", "tags": ["northeast"] },
    { "question": "What is the capital of South Carolina?", "answer": "Columbia", "tags": ["south"] },
    { "question": "What is the capital of South Dakota?", "answer": "Pierre", "tags": ["midwest"] },
    { "question": "What is the capital of Tennessee?", "answer": "Nashville", "tags": ["south"] },
    { "question": "What is the capital of Texas?", "answer": "Austin", "tags": ["south"] },
    { "question": "What is the capital of Utah?", "answer": "Salt Lake City", "tags": ["west"] },
    { "question": "What is the capital of Vermont?", "answer": "Montpelier", "tags": ["northeast"] },
    { "question": "What is the capital of Virginia?", "answer": "Richmond", "tags": ["south"] },
    { "question": "What is the capital of Washington?", "answer": "Olympia", "tags": ["west"] },
    { "question": "What is the capital of West Virginia?", "answer": "Charleston", "tags": ["south"] },
    { "question": "What is the capital of Wisconsin?", "answer": "Madison", "tags": ["midwest"] },
    { "question": "What is the capital of Wyoming?", "answer": "Cheyenne", "tags": ["west"] }
  ]
}
